{"voice":"wyckoff","date":"2026-09-02","round":2,"votes":[{"ticker":"WELL","vote":"SUPPORT","reason":"RANGE is the geography my method pays for (C1), and contraction is present (was_squeezed true, lens.coil strong, sma_distance 1.85 = at the mean, not chased). But effort is modest (day_vol 1.18), structure 60.0 is mid-pack, and the stop is fib_786 — a derived level, not a swing. No spring or upthrust read available: pin_bar_state NONE. I back the coil, not a turning point.","conviction":2,"conviction_change":"R1 3 -> 2. choch BEARISH and the 0.22% ma_20/ma_50 separation conceded as the finding, not a supporting detail.","opposing_case":null,"self_counter":null,"falsifier":"Close below 234.11 fib_786 stop, or the RANGE resolving down through the flat 236 shelf on day_vol >1.5.","challenge_reply":"Both findings accepted. I withdraw 'structure holding' — the engine's latest character read is BEARISH choch inside a RANGE, and ma_20 236.58 vs ma_50 236.05 is 0.22% apart: that flatness IS the range, not a stack. What ends the range read: a close through either 236-shelf edge on expanding effort; absent a range-boundary field I cannot name the level, which is why this is a 2 and not a 3.","obligations":{"o_a_hard_or_soft":"SOFT_WEIGHT","o_a_note":"Downweighted for uncited choch BEARISH and for describing flatness as alignment.","o_b_stop_honored":"234.11 fib_786, 2.62% risk, 1.31 ATR — declared derived, not a swing.","o_c_invalidation":"Close under 234.11, or a down-resolution of the RANGE on above-average volume."}},{"ticker":"CNH","vote":"OPPOSE","reason":"Geography fails at step 1: sma_distance 15.42 is the middle of a move, not the edge of a range (C1). lens.coil warn and was_squeezed false — my only objective timing test finds no contraction (C5). Effort is real (day_vol 1.51) but effort in mid-move buys nothing my method pays for. No spring/upthrust read available (pin_bar_state NONE). Bracket invalid, reported as context, not as the reason.","conviction":3,"conviction_change":null,"opposing_case":"15.4% above the mean with no measured contraction and no identifiable danger point. Buying here is buying the middle; if the reaction comes it starts 15% above where I would want to be wrong.","self_counter":null,"falsifier":"A pullback into 11.05 that holds and coils (lens.coil turning strong) would give me the geography I am refusing today.","challenge_reply":null,"obligations":null},{"ticker":"DE","vote":"OPPOSE","reason":"day_vol 1.93 is the heaviest effort in the packet, and it is arriving 10.19% above the mean with div_state BEARISH (1/5). That is the C12 fork at a high: either supply is absorbing, or the driving force is spent. Both end the thrust. No contraction (coil warn, was_squeezed false), no danger point (bracket invalid), no spring/upthrust read (pin_bar_state NONE). Not my trade.","conviction":3,"conviction_change":null,"opposing_case":"Heaviest volume of the set at the most extended point of the move with a bearish divergence is the exhaustion signature, not the entry. Advisory only (real SOT needs bar highs/lows), so this is a stand-aside, not a short.","self_counter":null,"falsifier":"A light-volume, narrow-range hold above 622.57 would be the successful test and would flip me constructive.","challenge_reply":null,"obligations":null},{"ticker":"AAPL","vote":"SUPPORT","reason":"The one name where contraction resolved with effort matching result: was_squeezed true, coil strong, base 8.5%, BREAKOUT_UP with squeeze_breakout_volume_confirmed true and day_vol 1.27, into BULLISH_BOS, at only 3.90% off the mean. C5/C6 both pass on served fields. Declared: no spring/upthrust read (pin_bar_state NONE), and bracket.valid false means no identifiable danger point — that caps me at 3.","conviction":3,"conviction_change":null,"opposing_case":null,"self_counter":null,"falsifier":"A close back inside the coil under 311.32 on above-average volume voids the breakout; that is a failed expansion, and failed expansions reverse.","challenge_reply":null,"obligations":null},{"ticker":"LNG","vote":"OPPOSE","reason":"12.08% above the mean, ABOVE_STRUCTURE, no coil (warn, was_squeezed false), no danger point (bracket invalid). Effort 1.37 is respectable but it is being spent in the middle of the move. My method finds nothing at step 1 or step 2. No spring/upthrust read available (pin_bar_state NONE).","conviction":3,"conviction_change":null,"opposing_case":"Mid-move with no measured contraction and no structural level to be wrong against. The trade my method pays for is the reaction to 273.92, not this.","self_counter":null,"falsifier":"A shallow low-volume reaction to 273.92 that holds would be the setup I am declining today.","challenge_reply":null,"obligations":null},{"ticker":"DB","vote":"OPPOSE","reason":"Effort and reward disagree against me: day_vol 1.27 with mp_accel DECELERATING and div_state BEARISH (1/5), 7.82% above the mean. That is the nearest served reading of shortening of the thrust (advisory, C11/C12). flow 56.6 is soft. Stop 38.74 is fib_618 — derived, not a swing low, so it is not a danger point in my sense. No spring/upthrust read (pin_bar_state NONE).","conviction":2,"conviction_change":null,"opposing_case":"Volume rising while acceleration falls and a bearish divergence prints is effort without reward near a high. Tight risk (2.12%) does not make it a setup; it makes a bad setup cheap.","self_counter":null,"falsifier":"mp_accel turning ACCELERATING with div_state clearing while price holds 38.65 would remove my objection.","challenge_reply":null,"obligations":null},{"ticker":"CVS","vote":"SUPPORT","reason":"Best geography in the packet for my seat: 97.60 sits BELOW ma_50 101.13 and above ma_20 94.76 and ma_200 86.27 — lower-half, not chased (sma_distance -3.49). was_squeezed true with coil strong (contraction measured on the served proxy), div_state BULLISH, BULLISH_BOS. Trap test (C15) does NOT fire: day_vol 1.05 is not heavy hammering at lows. Stop 95.16 is ma100 — a moving average, not a swing; disclosed.","conviction":3,"conviction_change":null,"opposing_case":null,"self_counter":null,"falsifier":"Close below 95.16 / loss of ma_20 94.76; or heavy day_vol appearing with no upward progress, which would turn this into the C15 bag-holding read.","challenge_reply":"Accepted. This is the only name where I stand under the 50-day and say so — NOT a spring. pin_bar_state is NONE, no penetration field is served, so the accumulation-shaped geography is inference from position and coil, not a detected turning point. Stop is ma100-derived, not a swing; that is why 3, not 4.","obligations":{"o_a_hard_or_soft":null,"o_a_note":"No withdrawal. Sub-ma_50 position restated as the load-bearing fact.","o_b_stop_honored":"95.16 ma100, 2.50% risk, rr 3.50 — declared MA-derived, not structural swing.","o_c_invalidation":"Close under 95.16, or heavy volume at the lows with zero upward progress (C15)."}},{"ticker":"GEN","vote":"OPPOSE","reason":"Effort is absent: day_vol 0.95 is below the name's own 20-day average while price sits 10.03% above the mean, with mp_state FADING and mp_accel FLAT. C6 gives me no ratio worth having — no effort behind the BULLISH_BOS. Stop 29.03 is ma20, sitting exactly at price's own average, so risk 3.30% is bought against a moving line, not a swing. No spring/upthrust read (pin_bar_state NONE).","conviction":2,"conviction_change":null,"opposing_case":"A break of structure that no volume showed up for, at 10% extension, with persistence already FADING. Extension plus no participation is where thrusts shorten.","self_counter":null,"falsifier":"day_vol above 1.3 on an up-close reclaiming progress would restore the effort leg.","challenge_reply":null,"obligations":null},{"ticker":"KHC","vote":"SUPPORT","reason":"RANGE geography with real contraction: was_squeezed true, coil strong, tightness 68.7, price 2.35% off a flat ma_20/ma_50 25.28 above ma_200 24.02. div_state BULLISH, insti_money strong. day_vol 0.91 — light effort, which is constructive here rather than bearish. The one true swing_low danger point in my SUPPORT list (25.17, 2.71% risk, rr 3.17). choch BEARISH and structure 57.9 hold it to 2.","conviction":2,"conviction_change":null,"opposing_case":null,"self_counter":null,"falsifier":"Close below the 25.17 swing low; or the flat 25.28 shelf resolving downward on expanding day_vol.","challenge_reply":"Both accepted. I said the danger point is swing-derived and that stands; I did not check stop_vol_validated, which reads FALSE — 25.17 was NOT defended on above-average volume, a geometric level, not a proven one. I repeat: no spring detectable — declared, not implied — pin_bar_state NONE, no penetration field exists.","obligations":{"o_a_hard_or_soft":"SOFT_WEIGHT","o_a_note":"Stop quality downgraded: swing-derived but stop_vol_validated FALSE. Conviction held at 2, not raised.","o_b_stop_honored":"25.17 swing_low, 2.71% risk, 1.01 ATR — genuine swing, volume-undefended.","o_c_invalidation":"Close under 25.17; or heavy down volume through the 25.28 shelf."}},{"ticker":"SLB","vote":"ABSTAIN","reason":"My primary character read is unavailable: choch_state, pin_bar_state, div_state, mp_accel_state and was_squeezed are all null, and every lens except structure/sector reads '--'. I will not substitute flow 90.8 or structure 80.0 for a character read — a composite is not a demand line. Context noted, not voted: sma_distance 13.93 is mid-move and bracket.valid is false. No spring/upthrust read available.","conviction":null,"conviction_change":null,"opposing_case":null,"self_counter":null,"falsifier":"Repair of choch_state and pin_bar_state on this record would let me vote; on today's row I cannot.","challenge_reply":null,"obligations":null},{"ticker":"EQT","vote":"OPPOSE","reason":"Inverted stack: ma_200 56.21 sits ABOVE price 55.59 and above ma_20 53.73 / ma_50 52.43. By C3 role reversal that 200-line is overhead supply, not support — this is a rally into a ceiling. Effort absent (day_vol 0.92), mp